{
  "schema_version": 1,
  "generated_at": "2026-05-11T19:34:59Z",
  "source": "scripts/artemis-runner.sh",
  "events": [
    {
      "schema_version": 1,
      "event_id": "evt_20260511t193459z-488-tkt-validate_planned",
      "event_type": "runner.attempt_planned",
      "generated_at": "2026-05-11T19:34:59Z",
      "producer": {
        "adapter": "local_runner",
        "name": "scripts/artemis-runner.sh",
        "mode": "supervised"
      },
      "subject": {
        "ticket": "TKT-VALIDATE",
        "task_id": "tkt-validate",
        "title": "Validate supervised runner",
        "exec_pack": "docs/exec-packs/active/TKT-VALIDATE.md",
        "artifact_root": "artifacts/artemis-validation-gate/run-01/symphony-queue-bridge-check/bridge/runner/attempts/20260511T193459Z-488-tkt-validate",
        "branch": "artemis/tkt-validate-validate-supervised-runner",
        "worktree": "../veri-artemis-worktrees/tkt-validate"
      },
      "runner": {
        "kind": "codex_cli",
        "attempt_id": "20260511T193459Z-488-tkt-validate",
        "command": "scripts/artemis-dry-run.sh --input artifacts/artemis-validation-gate/run-01/runner-task-source.json"
      },
      "state": {
        "from": "ready",
        "to": "running",
        "reason": "Supervised runner attempt planned with workspace readiness."
      },
      "gate": {
        "kind": "none",
        "status": "not_applicable"
      },
      "severity": "info",
      "evidence": {
        "artifact_path": "artifacts/artemis-validation-gate/run-01/symphony-queue-bridge-check/bridge/runner/attempts/20260511T193459Z-488-tkt-validate",
        "status_path": "artifacts/artemis-validation-gate/run-01/symphony-queue-bridge-check/bridge/runner/attempts/20260511T193459Z-488-tkt-validate/STATUS.md",
        "validation_path": "artifacts/artemis-validation-gate/run-01/symphony-queue-bridge-check/bridge/runner/attempts/20260511T193459Z-488-tkt-validate/VALIDATION.md",
        "handoff_path": "artifacts/artemis-validation-gate/run-01/symphony-queue-bridge-check/bridge/runner/attempts/20260511T193459Z-488-tkt-validate/HANDOFF.md",
        "logs": [
          "artifacts/artemis-validation-gate/run-01/symphony-queue-bridge-check/bridge/runner/attempts/20260511T193459Z-488-tkt-validate/dry-run.json",
          "artifacts/artemis-validation-gate/run-01/symphony-queue-bridge-check/bridge/runner/attempts/20260511T193459Z-488-tkt-validate/workspace.json",
          "artifacts/artemis-validation-gate/run-01/symphony-queue-bridge-check/bridge/runner/attempts/20260511T193459Z-488-tkt-validate/RUNNER.md",
          "artifacts/artemis-validation-gate/run-01/symphony-queue-bridge-check/bridge/runner/attempts/20260511T193459Z-488-tkt-validate/ENVIRONMENT.md",
          "artifacts/artemis-validation-gate/run-01/symphony-queue-bridge-check/bridge/runner/attempts/20260511T193459Z-488-tkt-validate/COMMAND.txt",
          "artifacts/artemis-validation-gate/run-01/symphony-queue-bridge-check/bridge/runner/attempts/20260511T193459Z-488-tkt-validate/RESULT.md"
        ]
      },
      "links": {
        "correlation_id": "tkt-validate"
      },
      "payload": {
        "attempt_id": "20260511T193459Z-488-tkt-validate",
        "execute": false,
        "command": "scripts/artemis-dry-run.sh --input artifacts/artemis-validation-gate/run-01/runner-task-source.json",
        "execution_cwd": "/srv/veri",
        "use_workspace": false,
        "attempt_purpose": "run",
        "retry_of": null,
        "workspace": {
          "mode": "planned",
          "branch": "artemis/tkt-validate-validate-supervised-runner",
          "worktree_path": "../veri-artemis-worktrees/tkt-validate",
          "lock_path": ".artemis/locks/tkt-validate.lock",
          "artifact_root": "artifacts/validate-runner/run-01",
          "writer": "Codex",
          "cleanup_state": "not_created"
        },
        "artifact_root": "artifacts/artemis-validation-gate/run-01/symphony-queue-bridge-check/bridge/runner",
        "reason": "Supervised runner attempt planned with workspace readiness."
      }
    },
    {
      "schema_version": 1,
      "event_id": "evt_20260511t193459z-488-tkt-validate_completed",
      "event_type": "runner.attempt_completed",
      "generated_at": "2026-05-11T19:34:59Z",
      "producer": {
        "adapter": "local_runner",
        "name": "scripts/artemis-runner.sh",
        "mode": "supervised"
      },
      "subject": {
        "ticket": "TKT-VALIDATE",
        "task_id": "tkt-validate",
        "title": "Validate supervised runner",
        "exec_pack": "docs/exec-packs/active/TKT-VALIDATE.md",
        "artifact_root": "artifacts/artemis-validation-gate/run-01/symphony-queue-bridge-check/bridge/runner/attempts/20260511T193459Z-488-tkt-validate",
        "branch": "artemis/tkt-validate-validate-supervised-runner",
        "worktree": "../veri-artemis-worktrees/tkt-validate"
      },
      "runner": {
        "kind": "codex_cli",
        "attempt_id": "20260511T193459Z-488-tkt-validate",
        "command": "scripts/artemis-dry-run.sh --input artifacts/artemis-validation-gate/run-01/runner-task-source.json"
      },
      "state": {
        "from": "running",
        "to": "review",
        "reason": "Supervised runner plan completed without command execution."
      },
      "gate": {
        "kind": "none",
        "status": "not_applicable"
      },
      "severity": "info",
      "evidence": {
        "artifact_path": "artifacts/artemis-validation-gate/run-01/symphony-queue-bridge-check/bridge/runner/attempts/20260511T193459Z-488-tkt-validate",
        "status_path": "artifacts/artemis-validation-gate/run-01/symphony-queue-bridge-check/bridge/runner/attempts/20260511T193459Z-488-tkt-validate/STATUS.md",
        "validation_path": "artifacts/artemis-validation-gate/run-01/symphony-queue-bridge-check/bridge/runner/attempts/20260511T193459Z-488-tkt-validate/VALIDATION.md",
        "handoff_path": "artifacts/artemis-validation-gate/run-01/symphony-queue-bridge-check/bridge/runner/attempts/20260511T193459Z-488-tkt-validate/HANDOFF.md",
        "logs": [
          "artifacts/artemis-validation-gate/run-01/symphony-queue-bridge-check/bridge/runner/attempts/20260511T193459Z-488-tkt-validate/dry-run.json",
          "artifacts/artemis-validation-gate/run-01/symphony-queue-bridge-check/bridge/runner/attempts/20260511T193459Z-488-tkt-validate/workspace.json",
          "artifacts/artemis-validation-gate/run-01/symphony-queue-bridge-check/bridge/runner/attempts/20260511T193459Z-488-tkt-validate/RUNNER.md",
          "artifacts/artemis-validation-gate/run-01/symphony-queue-bridge-check/bridge/runner/attempts/20260511T193459Z-488-tkt-validate/ENVIRONMENT.md",
          "artifacts/artemis-validation-gate/run-01/symphony-queue-bridge-check/bridge/runner/attempts/20260511T193459Z-488-tkt-validate/COMMAND.txt",
          "artifacts/artemis-validation-gate/run-01/symphony-queue-bridge-check/bridge/runner/attempts/20260511T193459Z-488-tkt-validate/RESULT.md"
        ]
      },
      "links": {
        "correlation_id": "tkt-validate"
      },
      "payload": {
        "attempt_id": "20260511T193459Z-488-tkt-validate",
        "execute": false,
        "command": "scripts/artemis-dry-run.sh --input artifacts/artemis-validation-gate/run-01/runner-task-source.json",
        "execution_cwd": "/srv/veri",
        "use_workspace": false,
        "attempt_purpose": "run",
        "retry_of": null,
        "workspace": {
          "mode": "planned",
          "branch": "artemis/tkt-validate-validate-supervised-runner",
          "worktree_path": "../veri-artemis-worktrees/tkt-validate",
          "lock_path": ".artemis/locks/tkt-validate.lock",
          "artifact_root": "artifacts/validate-runner/run-01",
          "writer": "Codex",
          "cleanup_state": "not_created"
        },
        "artifact_root": "artifacts/artemis-validation-gate/run-01/symphony-queue-bridge-check/bridge/runner",
        "exit_code": 0,
        "command_log": "artifacts/artemis-validation-gate/run-01/symphony-queue-bridge-check/bridge/runner/attempts/20260511T193459Z-488-tkt-validate/COMMAND.txt",
        "reason": "Supervised runner plan completed without command execution."
      }
    }
  ]
}
