{
  "schema_version": 1,
  "generated_at": "2026-05-06T20:01:09Z",
  "source": "scripts/artemis-runner.sh",
  "events": [
    {
      "schema_version": 1,
      "event_id": "evt_20260506t200109z-30-tkt-947_planned",
      "event_type": "runner.attempt_planned",
      "generated_at": "2026-05-06T20:01:09Z",
      "producer": {
        "adapter": "local_runner",
        "name": "scripts/artemis-runner.sh",
        "mode": "supervised"
      },
      "subject": {
        "ticket": "TKT-947",
        "task_id": "tkt-947",
        "title": "Validate queue bridge plan-only dispatch",
        "exec_pack": "docs/exec-packs/done/TKT-047-artemis-symphony-queue-bridge.md",
        "artifact_root": "artifacts/artemis-symphony-queue-bridge/run-01/bridge/runner/attempts/20260506T200109Z-30-tkt-947",
        "branch": "artemis/tkt-947-validate-queue-bridge-plan-only-disp",
        "worktree": "../veri-artemis-worktrees/tkt-947"
      },
      "runner": {
        "kind": "codex_cli",
        "attempt_id": "20260506T200109Z-30-tkt-947",
        "command": "scripts/artemis-dry-run.sh --input artifacts/artemis-symphony-queue-bridge/run-01/fixtures/task-source.json"
      },
      "state": {
        "from": "ready",
        "to": "running",
        "reason": "Supervised runner attempt planned with workspace readiness."
      },
      "gate": {
        "kind": "none",
        "status": "not_applicable"
      },
      "severity": "info",
      "evidence": {
        "artifact_path": "artifacts/artemis-symphony-queue-bridge/run-01/bridge/runner/attempts/20260506T200109Z-30-tkt-947",
        "status_path": "artifacts/artemis-symphony-queue-bridge/run-01/bridge/runner/attempts/20260506T200109Z-30-tkt-947/STATUS.md",
        "validation_path": "artifacts/artemis-symphony-queue-bridge/run-01/bridge/runner/attempts/20260506T200109Z-30-tkt-947/VALIDATION.md",
        "handoff_path": "artifacts/artemis-symphony-queue-bridge/run-01/bridge/runner/attempts/20260506T200109Z-30-tkt-947/HANDOFF.md",
        "logs": [
          "artifacts/artemis-symphony-queue-bridge/run-01/bridge/runner/attempts/20260506T200109Z-30-tkt-947/dry-run.json",
          "artifacts/artemis-symphony-queue-bridge/run-01/bridge/runner/attempts/20260506T200109Z-30-tkt-947/workspace.json",
          "artifacts/artemis-symphony-queue-bridge/run-01/bridge/runner/attempts/20260506T200109Z-30-tkt-947/RUNNER.md",
          "artifacts/artemis-symphony-queue-bridge/run-01/bridge/runner/attempts/20260506T200109Z-30-tkt-947/ENVIRONMENT.md",
          "artifacts/artemis-symphony-queue-bridge/run-01/bridge/runner/attempts/20260506T200109Z-30-tkt-947/COMMAND.txt",
          "artifacts/artemis-symphony-queue-bridge/run-01/bridge/runner/attempts/20260506T200109Z-30-tkt-947/RESULT.md"
        ]
      },
      "links": {
        "correlation_id": "tkt-947"
      },
      "payload": {
        "attempt_id": "20260506T200109Z-30-tkt-947",
        "execute": false,
        "command": "scripts/artemis-dry-run.sh --input artifacts/artemis-symphony-queue-bridge/run-01/fixtures/task-source.json",
        "execution_cwd": "/srv/veri",
        "use_workspace": false,
        "attempt_purpose": "run",
        "retry_of": null,
        "workspace": {
          "mode": "planned",
          "branch": "artemis/tkt-947-validate-queue-bridge-plan-only-disp",
          "worktree_path": "../veri-artemis-worktrees/tkt-947",
          "lock_path": ".artemis/locks/tkt-947.lock",
          "artifact_root": "artifacts/artemis-symphony-queue-bridge/run-01",
          "writer": "Codex",
          "cleanup_state": "not_created"
        },
        "artifact_root": "artifacts/artemis-symphony-queue-bridge/run-01/bridge/runner",
        "reason": "Supervised runner attempt planned with workspace readiness."
      }
    },
    {
      "schema_version": 1,
      "event_id": "evt_20260506t200109z-30-tkt-947_completed",
      "event_type": "runner.attempt_completed",
      "generated_at": "2026-05-06T20:01:09Z",
      "producer": {
        "adapter": "local_runner",
        "name": "scripts/artemis-runner.sh",
        "mode": "supervised"
      },
      "subject": {
        "ticket": "TKT-947",
        "task_id": "tkt-947",
        "title": "Validate queue bridge plan-only dispatch",
        "exec_pack": "docs/exec-packs/done/TKT-047-artemis-symphony-queue-bridge.md",
        "artifact_root": "artifacts/artemis-symphony-queue-bridge/run-01/bridge/runner/attempts/20260506T200109Z-30-tkt-947",
        "branch": "artemis/tkt-947-validate-queue-bridge-plan-only-disp",
        "worktree": "../veri-artemis-worktrees/tkt-947"
      },
      "runner": {
        "kind": "codex_cli",
        "attempt_id": "20260506T200109Z-30-tkt-947",
        "command": "scripts/artemis-dry-run.sh --input artifacts/artemis-symphony-queue-bridge/run-01/fixtures/task-source.json"
      },
      "state": {
        "from": "running",
        "to": "review",
        "reason": "Supervised runner plan completed without command execution."
      },
      "gate": {
        "kind": "none",
        "status": "not_applicable"
      },
      "severity": "info",
      "evidence": {
        "artifact_path": "artifacts/artemis-symphony-queue-bridge/run-01/bridge/runner/attempts/20260506T200109Z-30-tkt-947",
        "status_path": "artifacts/artemis-symphony-queue-bridge/run-01/bridge/runner/attempts/20260506T200109Z-30-tkt-947/STATUS.md",
        "validation_path": "artifacts/artemis-symphony-queue-bridge/run-01/bridge/runner/attempts/20260506T200109Z-30-tkt-947/VALIDATION.md",
        "handoff_path": "artifacts/artemis-symphony-queue-bridge/run-01/bridge/runner/attempts/20260506T200109Z-30-tkt-947/HANDOFF.md",
        "logs": [
          "artifacts/artemis-symphony-queue-bridge/run-01/bridge/runner/attempts/20260506T200109Z-30-tkt-947/dry-run.json",
          "artifacts/artemis-symphony-queue-bridge/run-01/bridge/runner/attempts/20260506T200109Z-30-tkt-947/workspace.json",
          "artifacts/artemis-symphony-queue-bridge/run-01/bridge/runner/attempts/20260506T200109Z-30-tkt-947/RUNNER.md",
          "artifacts/artemis-symphony-queue-bridge/run-01/bridge/runner/attempts/20260506T200109Z-30-tkt-947/ENVIRONMENT.md",
          "artifacts/artemis-symphony-queue-bridge/run-01/bridge/runner/attempts/20260506T200109Z-30-tkt-947/COMMAND.txt",
          "artifacts/artemis-symphony-queue-bridge/run-01/bridge/runner/attempts/20260506T200109Z-30-tkt-947/RESULT.md"
        ]
      },
      "links": {
        "correlation_id": "tkt-947"
      },
      "payload": {
        "attempt_id": "20260506T200109Z-30-tkt-947",
        "execute": false,
        "command": "scripts/artemis-dry-run.sh --input artifacts/artemis-symphony-queue-bridge/run-01/fixtures/task-source.json",
        "execution_cwd": "/srv/veri",
        "use_workspace": false,
        "attempt_purpose": "run",
        "retry_of": null,
        "workspace": {
          "mode": "planned",
          "branch": "artemis/tkt-947-validate-queue-bridge-plan-only-disp",
          "worktree_path": "../veri-artemis-worktrees/tkt-947",
          "lock_path": ".artemis/locks/tkt-947.lock",
          "artifact_root": "artifacts/artemis-symphony-queue-bridge/run-01",
          "writer": "Codex",
          "cleanup_state": "not_created"
        },
        "artifact_root": "artifacts/artemis-symphony-queue-bridge/run-01/bridge/runner",
        "exit_code": 0,
        "command_log": "artifacts/artemis-symphony-queue-bridge/run-01/bridge/runner/attempts/20260506T200109Z-30-tkt-947/COMMAND.txt",
        "reason": "Supervised runner plan completed without command execution."
      }
    }
  ]
}
