{
  "schema_version": 1,
  "generated_at": "2026-05-07T17:38:47Z",
  "source": "scripts/artemis-runner.sh",
  "events": [
    {
      "schema_version": 1,
      "event_id": "evt_20260507t173847z-66-tkt-949_planned",
      "event_type": "runner.attempt_planned",
      "generated_at": "2026-05-07T17:38:47Z",
      "producer": {
        "adapter": "local_runner",
        "name": "scripts/artemis-runner.sh",
        "mode": "supervised"
      },
      "subject": {
        "ticket": "TKT-949",
        "task_id": "tkt-949",
        "title": "Validate finite Symphony service",
        "exec_pack": "docs/exec-packs/done/TKT-049-artemis-symphony-service.md",
        "artifact_root": "artifacts/artemis-symphony-service/run-01/queue-bridge/bridge/runner/attempts/20260507T173847Z-66-tkt-949",
        "branch": "artemis/tkt-949-validate-finite-symphony-service",
        "worktree": "../veri-artemis-worktrees/tkt-949"
      },
      "runner": {
        "kind": "codex_cli",
        "attempt_id": "20260507T173847Z-66-tkt-949",
        "command": "scripts/artemis-dry-run.sh --input artifacts/artemis-symphony-service/run-01/fixtures/task-source.json"
      },
      "state": {
        "from": "ready",
        "to": "running",
        "reason": "Supervised runner attempt planned with workspace readiness."
      },
      "gate": {
        "kind": "none",
        "status": "not_applicable"
      },
      "severity": "info",
      "evidence": {
        "artifact_path": "artifacts/artemis-symphony-service/run-01/queue-bridge/bridge/runner/attempts/20260507T173847Z-66-tkt-949",
        "status_path": "artifacts/artemis-symphony-service/run-01/queue-bridge/bridge/runner/attempts/20260507T173847Z-66-tkt-949/STATUS.md",
        "validation_path": "artifacts/artemis-symphony-service/run-01/queue-bridge/bridge/runner/attempts/20260507T173847Z-66-tkt-949/VALIDATION.md",
        "handoff_path": "artifacts/artemis-symphony-service/run-01/queue-bridge/bridge/runner/attempts/20260507T173847Z-66-tkt-949/HANDOFF.md",
        "logs": [
          "artifacts/artemis-symphony-service/run-01/queue-bridge/bridge/runner/attempts/20260507T173847Z-66-tkt-949/dry-run.json",
          "artifacts/artemis-symphony-service/run-01/queue-bridge/bridge/runner/attempts/20260507T173847Z-66-tkt-949/workspace.json",
          "artifacts/artemis-symphony-service/run-01/queue-bridge/bridge/runner/attempts/20260507T173847Z-66-tkt-949/RUNNER.md",
          "artifacts/artemis-symphony-service/run-01/queue-bridge/bridge/runner/attempts/20260507T173847Z-66-tkt-949/ENVIRONMENT.md",
          "artifacts/artemis-symphony-service/run-01/queue-bridge/bridge/runner/attempts/20260507T173847Z-66-tkt-949/COMMAND.txt",
          "artifacts/artemis-symphony-service/run-01/queue-bridge/bridge/runner/attempts/20260507T173847Z-66-tkt-949/RESULT.md"
        ]
      },
      "links": {
        "correlation_id": "tkt-949"
      },
      "payload": {
        "attempt_id": "20260507T173847Z-66-tkt-949",
        "execute": false,
        "command": "scripts/artemis-dry-run.sh --input artifacts/artemis-symphony-service/run-01/fixtures/task-source.json",
        "execution_cwd": "/srv/veri",
        "use_workspace": false,
        "attempt_purpose": "run",
        "retry_of": null,
        "workspace": {
          "mode": "planned",
          "branch": "artemis/tkt-949-validate-finite-symphony-service",
          "worktree_path": "../veri-artemis-worktrees/tkt-949",
          "lock_path": ".artemis/locks/tkt-949.lock",
          "artifact_root": "artifacts/artemis-symphony-service/run-01",
          "writer": "Codex",
          "cleanup_state": "not_created"
        },
        "artifact_root": "artifacts/artemis-symphony-service/run-01/queue-bridge/bridge/runner",
        "reason": "Supervised runner attempt planned with workspace readiness."
      }
    },
    {
      "schema_version": 1,
      "event_id": "evt_20260507t173847z-66-tkt-949_completed",
      "event_type": "runner.attempt_completed",
      "generated_at": "2026-05-07T17:38:47Z",
      "producer": {
        "adapter": "local_runner",
        "name": "scripts/artemis-runner.sh",
        "mode": "supervised"
      },
      "subject": {
        "ticket": "TKT-949",
        "task_id": "tkt-949",
        "title": "Validate finite Symphony service",
        "exec_pack": "docs/exec-packs/done/TKT-049-artemis-symphony-service.md",
        "artifact_root": "artifacts/artemis-symphony-service/run-01/queue-bridge/bridge/runner/attempts/20260507T173847Z-66-tkt-949",
        "branch": "artemis/tkt-949-validate-finite-symphony-service",
        "worktree": "../veri-artemis-worktrees/tkt-949"
      },
      "runner": {
        "kind": "codex_cli",
        "attempt_id": "20260507T173847Z-66-tkt-949",
        "command": "scripts/artemis-dry-run.sh --input artifacts/artemis-symphony-service/run-01/fixtures/task-source.json"
      },
      "state": {
        "from": "running",
        "to": "review",
        "reason": "Supervised runner plan completed without command execution."
      },
      "gate": {
        "kind": "none",
        "status": "not_applicable"
      },
      "severity": "info",
      "evidence": {
        "artifact_path": "artifacts/artemis-symphony-service/run-01/queue-bridge/bridge/runner/attempts/20260507T173847Z-66-tkt-949",
        "status_path": "artifacts/artemis-symphony-service/run-01/queue-bridge/bridge/runner/attempts/20260507T173847Z-66-tkt-949/STATUS.md",
        "validation_path": "artifacts/artemis-symphony-service/run-01/queue-bridge/bridge/runner/attempts/20260507T173847Z-66-tkt-949/VALIDATION.md",
        "handoff_path": "artifacts/artemis-symphony-service/run-01/queue-bridge/bridge/runner/attempts/20260507T173847Z-66-tkt-949/HANDOFF.md",
        "logs": [
          "artifacts/artemis-symphony-service/run-01/queue-bridge/bridge/runner/attempts/20260507T173847Z-66-tkt-949/dry-run.json",
          "artifacts/artemis-symphony-service/run-01/queue-bridge/bridge/runner/attempts/20260507T173847Z-66-tkt-949/workspace.json",
          "artifacts/artemis-symphony-service/run-01/queue-bridge/bridge/runner/attempts/20260507T173847Z-66-tkt-949/RUNNER.md",
          "artifacts/artemis-symphony-service/run-01/queue-bridge/bridge/runner/attempts/20260507T173847Z-66-tkt-949/ENVIRONMENT.md",
          "artifacts/artemis-symphony-service/run-01/queue-bridge/bridge/runner/attempts/20260507T173847Z-66-tkt-949/COMMAND.txt",
          "artifacts/artemis-symphony-service/run-01/queue-bridge/bridge/runner/attempts/20260507T173847Z-66-tkt-949/RESULT.md"
        ]
      },
      "links": {
        "correlation_id": "tkt-949"
      },
      "payload": {
        "attempt_id": "20260507T173847Z-66-tkt-949",
        "execute": false,
        "command": "scripts/artemis-dry-run.sh --input artifacts/artemis-symphony-service/run-01/fixtures/task-source.json",
        "execution_cwd": "/srv/veri",
        "use_workspace": false,
        "attempt_purpose": "run",
        "retry_of": null,
        "workspace": {
          "mode": "planned",
          "branch": "artemis/tkt-949-validate-finite-symphony-service",
          "worktree_path": "../veri-artemis-worktrees/tkt-949",
          "lock_path": ".artemis/locks/tkt-949.lock",
          "artifact_root": "artifacts/artemis-symphony-service/run-01",
          "writer": "Codex",
          "cleanup_state": "not_created"
        },
        "artifact_root": "artifacts/artemis-symphony-service/run-01/queue-bridge/bridge/runner",
        "exit_code": 0,
        "command_log": "artifacts/artemis-symphony-service/run-01/queue-bridge/bridge/runner/attempts/20260507T173847Z-66-tkt-949/COMMAND.txt",
        "reason": "Supervised runner plan completed without command execution."
      }
    }
  ]
}
