{
  "schema_version": 1,
  "generated_at": "2026-05-07T12:49:15Z",
  "source": "scripts/artemis-symphony-bridge.sh",
  "events": [
    {
      "schema_version": 1,
      "event_id": "evt_tkt-validate_symphony_bridge",
      "event_type": "runner.attempt_planned",
      "generated_at": "2026-05-07T12:49:15Z",
      "producer": {
        "adapter": "local_runner",
        "name": "scripts/artemis-symphony-bridge.sh",
        "mode": "supervised"
      },
      "subject": {
        "ticket": "TKT-VALIDATE",
        "task_id": "tkt-validate",
        "title": "Validate supervised runner",
        "exec_pack": "docs/exec-packs/active/TKT-VALIDATE.md",
        "artifact_root": "artifacts/artemis-validation-gate/run-01/symphony-bridge-check"
      },
      "runner": {
        "kind": "codex_cli",
        "command": "scripts/artemis-dry-run.sh --input artifacts/artemis-validation-gate/run-01/runner-task-source.json"
      },
      "state": {
        "from": "ready",
        "to": "running",
        "reason": "Symphony bridge created a supervised runner attempt."
      },
      "gate": {
        "kind": "none",
        "status": "not_applicable"
      },
      "severity": "info",
      "evidence": {
        "artifact_path": "artifacts/artemis-validation-gate/run-01/symphony-bridge-check",
        "status_path": "artifacts/artemis-validation-gate/run-01/symphony-bridge-check/STATUS.md",
        "validation_path": "artifacts/artemis-validation-gate/run-01/symphony-bridge-check/VALIDATION.md",
        "handoff_path": "artifacts/artemis-validation-gate/run-01/symphony-bridge-check/HANDOFF.md",
        "logs": [
          "artifacts/artemis-validation-gate/run-01/symphony-bridge-check/kernel/symphony-kernel.json",
          "artifacts/artemis-validation-gate/run-01/symphony-bridge-check/runner/attempts/20260507T124915Z-305-tkt-validate/events.json"
        ]
      },
      "links": {
        "correlation_id": "tkt-validate"
      },
      "payload": {
        "reason": "Symphony bridge created a supervised runner attempt.",
        "overall": "runner_plan_ready",
        "execute_requested": false,
        "commands_executed": 0,
        "automatic_daemon": false
      }
    }
  ]
}
