{
  "schema_version": 1,
  "generated_at": "2026-05-15T16:30:10Z",
  "source": "scripts/artemis-symphony-remote-promotion.sh",
  "events": [
    {
      "schema_version": 1,
      "event_id": "evt_tkt-052_symphony_remote_promotion",
      "event_type": "approval.resolved",
      "generated_at": "2026-05-15T16:30:10Z",
      "producer": {
        "adapter": "symphony_remote_promotion",
        "name": "scripts/artemis-symphony-remote-promotion.sh",
        "mode": "supervised"
      },
      "subject": {
        "ticket": "TKT-052",
        "task_id": "tkt-052",
        "title": "Promocao local do intake remoto do ARTEMIS Symphony",
        "exec_pack": "docs/exec-packs/done/TKT-052-artemis-symphony-remote-promotion.md",
        "artifact_root": "artifacts/artemis-validation-gate/run-01/symphony-promotion-check"
      },
      "runner": {
        "kind": "none",
        "command": "scripts/artemis-dry-run.sh --input artifacts/artemis-validation-gate/run-01/symphony-promotion-check/promoted-source.json"
      },
      "state": {
        "from": "review",
        "to": "ready",
        "reason": "Exact human decision promoted reviewed intake into a local task source."
      },
      "gate": {
        "kind": "none",
        "status": "not_applicable"
      },
      "severity": "info",
      "evidence": {
        "artifact_path": "artifacts/artemis-validation-gate/run-01/symphony-promotion-check",
        "status_path": "artifacts/artemis-validation-gate/run-01/symphony-promotion-check/STATUS.md",
        "validation_path": "artifacts/artemis-validation-gate/run-01/symphony-promotion-check/VALIDATION.md",
        "handoff_path": "artifacts/artemis-validation-gate/run-01/symphony-promotion-check/HANDOFF.md",
        "logs": []
      },
      "links": {
        "correlation_id": "tkt-052"
      },
      "payload": {
        "overall": "remote_promotion_ready",
        "reason": "Exact human decision promoted reviewed intake into a local task source.",
        "summary": {
          "intake_items": 1,
          "review_ready": 1,
          "promoted": 1,
          "human_gate": 0,
          "blocked": 0,
          "promotion_allowed": 1,
          "direct_dispatch_allowed": false,
          "remote_writes_allowed": false,
          "runner_auto_execution_allowed": false,
          "queue_called": false,
          "bridge_called": false,
          "runner_called": false,
          "commands_executed": 0
        },
        "contract": {
          "remote_intake_defines": "review_package",
          "human_decision_defines": "local_promotion_authority",
          "exec_pack_defines": "execution_contract",
          "promoted_source_state": "ready_after_exact_human_decision",
          "terminal_command_required": true,
          "validation_gate_required_before_execute": true,
          "queue_call": "blocked",
          "bridge_call": "blocked",
          "runner_call": "blocked",
          "direct_dispatch": "blocked",
          "remote_writes": "blocked",
          "terminal_first": true,
          "human_gates_preserved": true
        },
        "next_cut": "TKT-070 - Agent Runtime Done Ledger do ARTEMIS Symphony"
      }
    }
  ]
}
