{
  "schema_version": 1,
  "generated_at": "2026-05-07T14:55:45Z",
  "source": "scripts/artemis-symphony-remote-intake.sh",
  "events": [
    {
      "schema_version": 1,
      "event_id": "evt_tkt-051_symphony_remote_intake",
      "event_type": "adapter.contract_recorded",
      "generated_at": "2026-05-07T14:55:45Z",
      "producer": {
        "adapter": "symphony_remote_intake",
        "name": "scripts/artemis-symphony-remote-intake.sh",
        "mode": "read_only_remote_intake_review"
      },
      "subject": {
        "ticket": "TKT-051",
        "task_id": "tkt-051",
        "title": "Intake remoto revisavel do ARTEMIS Symphony",
        "exec_pack": "docs/exec-packs/done/TKT-051-artemis-symphony-remote-intake.md",
        "artifact_root": "artifacts/artemis-validation-gate/run-01/symphony-remote-intake-check"
      },
      "runner": {
        "kind": "none",
        "commands_executed": 0
      },
      "state": {
        "from": "planned",
        "to": "review",
        "reason": "Remote intake items are ready for human review before local promotion."
      },
      "gate": {
        "kind": "none",
        "status": "not_applicable"
      },
      "severity": "info",
      "evidence": {
        "artifact_path": "artifacts/artemis-validation-gate/run-01/symphony-remote-intake-check",
        "status_path": "artifacts/artemis-validation-gate/run-01/symphony-remote-intake-check/STATUS.md",
        "validation_path": "artifacts/artemis-validation-gate/run-01/symphony-remote-intake-check/VALIDATION.md",
        "handoff_path": "artifacts/artemis-validation-gate/run-01/symphony-remote-intake-check/HANDOFF.md",
        "logs": []
      },
      "links": {
        "correlation_id": "tkt-051"
      },
      "payload": {
        "overall": "remote_intake_ready",
        "reason": "Remote intake items are ready for human review before local promotion.",
        "summary": {
          "remote_available": true,
          "remote_source_overall": "remote_source_ready",
          "items_total": 1,
          "review_ready": 1,
          "human_gate": 0,
          "blocked": 0,
          "observed_done": 0,
          "review_required": 1,
          "promotion_allowed": 0,
          "direct_dispatch_allowed": false,
          "remote_writes_allowed": false,
          "runner_auto_execution_allowed": false,
          "commands_executed": 0
        },
        "contract": {
          "remote_source_defines": "intent_and_evidence",
          "remote_intake_defines": "review_package",
          "exec_pack_defines": "execution_contract",
          "promotion": "blocked_until_explicit_human_review",
          "review_source_state": "human",
          "direct_dispatch": "blocked",
          "remote_writes": "blocked",
          "terminal_first": true,
          "human_gates_preserved": true,
          "validation_gate_required_before_execute": true
        },
        "next_cut": "TKT-056 - Human-readable Project Brief do ARTEMIS Symphony"
      }
    }
  ]
}
